{
  "id": "2026-09-22-has-anyone-sent-something-inside",
  "slug": "has-anyone-sent-something-inside",
  "title": "Enquirer’s Guide: Has anyone sent something inside?",
  "summary": "Yes.",
  "category": "common-enquiries",
  "published_at": "2026-09-22T19:10:00Z",
  "author": "The Enquirer’s Guide Desk",
  "dateline": "Alderwick",
  "paragraphs": [
    "This entry from The Enquirer’s Guide answers a question often put to the Society: “Has anyone sent something inside?”",
    "Yes.",
    "In 1844 a stable aperture admitted a tethered brass probe, which returned carrying a pale mineral deposit. Later probes and expeditions extended the surveys, although every crossing still demands careful records of what went out and what came back.",
    "Readers should treat the answer as an introduction rather than a final authority. Eidetic science in Alderwick is reported through measurements, disputed interpretations and careful revisions, and a respectable enquiry may properly end with further questions."
  ],
  "tags": [
    "common-enquiries",
    "enquirers-guide",
    "has-anyone-sent-something-inside"
  ],
  "image": null,
  "related_ids": []
}
