{
 "id":"2026-09-25-lost-brass-case", "slug":"lost-brass-case", "title":"Small Brass Case Missing from Quay Road", "summary":"The owner seeks a plain instrument case, not its contents.", "category":"agony-column", "published_at":"2026-09-25T09:00:00Z", "author":"Notices Desk", "paragraphs":[
  "A small brass instrument case was lost between the North Quay tram stop and the public reading room on Wednesday evening. Its lid bears a scratched numeral seven beside a maker's mark almost worn away.",
  "The owner asks that the case be returned unopened to the reading-room attendant. A modest reward will be paid upon identification; no account of the contents is required."
 ], "tags":["quay","notices"], "image":null, "related_ids":[]
}
