{
 "id":"2026-09-24-advice-on-a-promised-book", "slug":"advice-on-a-promised-book", "title":"On a Book Promised and Never Sent", "summary":"A reader asks whether a friend's forgotten loan should be mentioned again.", "category":"agony-column", "published_at":"2026-09-24T12:40:00Z", "author":"The Correspondent's Adviser", "paragraphs":[
 "A subscriber has waited two months for a book that an old friend offered to lend. She now hesitates to ask again, fearing that the request would convert a kindness into an obligation.",
 "There is no discourtesy in a single reminder, provided it leaves the giver free to reconsider. The book may be in use, misplaced or dearer to its owner than was understood when the offer was made.",
 "A short note can say that the title was remembered with pleasure and that no inconvenience should be taken on its account. It need not rehearse the original promise or explain why the volume is wanted.",
 "Should the friend answer with silence, borrow another copy if one can be found. Friendship is a poor ledger, and the finest books rarely profit from being entered in it."
 ], "tags":["books","etiquette","letters"], "image":null, "related_ids":["2026-09-25-letter-from-the-arcade"]
}
