{
  "id": "2026-09-22-why-do-the-newspapers-report-it-every-day",
  "slug": "why-do-the-newspapers-report-it-every-day",
  "title": "Enquirer’s Guide: Why do the newspapers report it every day?",
  "summary": "Readings from Alderwick’s receiving hall affect expeditions, relay messages, museum collections, and sometimes commerce.",
  "category": "common-enquiries",
  "published_at": "2026-09-22T18:30:00Z",
  "author": "The Enquirer’s Guide Desk",
  "dateline": "Alderwick",
  "paragraphs": [
    "This entry from The Enquirer’s Guide answers a question often put to the Society: “Why do the newspapers report it every day?”",
    "Readings from Alderwick’s receiving hall affect expeditions, relay messages, museum collections, and sometimes commerce.",
    "Newspapers also report claims that have not survived inspection. The daily story may be a clear measurement, a disputed interpretation, or simply a missing traveler whom the authorities are still seeking.",
    "Readers should treat the answer as an introduction rather than a final authority. Eidetic science in Alderwick is reported through measurements, disputed interpretations and careful revisions, and a respectable enquiry may properly end with further questions."
  ],
  "tags": [
    "common-enquiries",
    "enquirers-guide",
    "why-do-the-newspapers-report-it-every-day"
  ],
  "image": null,
  "related_ids": []
}
